{
  "$schema": "https://json-schema.org/draft/2020-12/schema",
  "$id": "agentic-workspace/conformance.schema.json",
  "title": "Conformance",
  "description": "Source-maintenance model only; not native/public command authority. Conformance fixture contract for proving an operation adapter behaves as expected.",
  "type": "object",
  "required": [
    "schema_version",
    "id",
    "operation_id",
    "adapter",
    "fixtures",
    "expectations",
    "migration_status"
  ],
  "properties": {
    "schema_version": {
      "const": "agentic-workspace/conformance/v1",
      "description": "Conformance contract version."
    },
    "id": {
      "type": "string",
      "minLength": 1,
      "description": "Stable conformance fixture identifier."
    },
    "operation_id": {
      "type": "string",
      "minLength": 1,
      "description": "Operation contract exercised by this fixture."
    },
    "adapter": {
      "type": "object",
      "required": [
        "kind",
        "command_template",
        "cwd"
      ],
      "properties": {
        "kind": {
          "const": "process",
          "description": "Adapter family used to run the fixture command."
        },
        "command_template": {
          "type": "array",
          "minItems": 1,
          "items": {
            "type": "string",
            "minLength": 1,
            "description": "One argv token in the command template."
          },
          "description": "Command argv template executed for each fixture."
        },
        "cwd": {
          "enum": [
            "fixture_root",
            "repo_root"
          ],
          "description": "Working directory used when executing the adapter."
        }
      },
      "additionalProperties": false,
      "description": "Process adapter used to invoke the operation under test."
    },
    "fixtures": {
      "type": "array",
      "minItems": 1,
      "items": {
        "type": "object",
        "required": [
          "id",
          "files"
        ],
        "properties": {
          "id": {
            "type": "string",
            "minLength": 1,
            "description": "Stable fixture case identifier."
          },
          "files": {
            "type": "object",
            "additionalProperties": {
              "type": "string",
              "description": "File content keyed by fixture-relative path."
            },
            "description": "Files to materialize before running this fixture."
          },
          "setup_steps": {
            "type": "array",
            "items": {
              "type": "object",
              "required": [
                "id",
                "command_template",
                "cwd",
                "allowed_write_paths"
              ],
              "properties": {
                "id": {
                  "type": "string",
                  "minLength": 1,
                  "description": "Stable setup-step identifier."
                },
                "command_template": {
                  "type": "array",
                  "minItems": 1,
                  "items": {
                    "type": "string",
                    "minLength": 1,
                    "description": "One argv token in the setup command template."
                  },
                  "description": "Command argv template executed before the adapter command."
                },
                "cwd": {
                  "enum": [
                    "fixture_root",
                    "repo_root"
                  ],
                  "description": "Working directory used when executing the setup command."
                },
                "allowed_write_paths": {
                  "$ref": "#/$defs/path_list",
                  "description": "Exact fixture paths the setup command may create or modify."
                },
                "allowed_write_directories": {
                  "$ref": "#/$defs/path_list",
                  "description": "Fixture directories below which the setup command may create or modify paths recursively."
                }
              },
              "additionalProperties": false,
              "description": "A setup command that prepares the fixture before adapter execution."
            },
            "description": "Optional setup commands that run after file materialization and before adapter execution."
          }
        },
        "additionalProperties": false,
        "description": "One entry in the fixtures list."
      },
      "description": "Fixture roots and files used as conformance inputs."
    },
    "expectations": {
      "type": "object",
      "required": [
        "exit",
        "stdout",
        "stderr",
        "filesystem",
        "idempotency",
        "safety"
      ],
      "properties": {
        "exit": {
          "type": "object",
          "required": [
            "code"
          ],
          "properties": {
            "code": {
              "type": "integer",
              "description": "Expected process exit code."
            }
          },
          "additionalProperties": false,
          "description": "Expected process exit behavior."
        },
        "stdout": {
          "type": "object",
          "required": [
            "format",
            "field_assertions"
          ],
          "properties": {
            "format": {
              "enum": [
                "json",
                "text"
              ],
              "description": "Expected stdout format."
            },
            "schema": {
              "type": "string",
              "minLength": 1,
              "description": "Schema that should validate stdout when the output is JSON."
            },
            "allow_empty": {
              "type": "boolean",
              "description": "Whether empty stdout is acceptable for text-mode refusal cases."
            },
            "contains": {
              "type": "array",
              "items": {
                "type": "string",
                "minLength": 1,
                "description": "Text that must appear in stdout."
              },
              "description": "Required stdout substrings for text fixtures."
            },
            "field_assertions": {
              "type": "array",
              "items": {
                "$ref": "#/$defs/field_assertion",
                "description": "One entry in the field assertions list."
              },
              "description": "Field-level stdout assertions evaluated after parsing."
            },
            "typescript_field_assertions": {
              "type": "array",
              "items": {
                "$ref": "#/$defs/field_assertion",
                "description": "One entry in the TypeScript field assertions list."
              },
              "description": "TypeScript-specific stdout assertions used when the native compact projection intentionally differs from the canonical runtime projection."
            }
          },
          "additionalProperties": false,
          "description": "Expected standard-output format and field assertions."
        },
        "stderr": {
          "type": "object",
          "required": [
            "allow_non_empty"
          ],
          "properties": {
            "allow_non_empty": {
              "type": "boolean",
              "description": "Whether non-empty stderr is acceptable for this fixture."
            },
            "contains": {
              "type": "array",
              "items": {
                "type": "string",
                "minLength": 1,
                "description": "Text that must appear in stderr."
              },
              "description": "Required stderr substrings for refusal or usage-error fixtures."
            }
          },
          "additionalProperties": false,
          "description": "Policy for stderr emitted by the adapter command."
        },
        "filesystem": {
          "type": "object",
          "required": [
            "allowed_write_paths",
            "required_paths",
            "forbidden_paths"
          ],
          "properties": {
            "allowed_write_paths": {
              "$ref": "#/$defs/path_list",
              "description": "Exact fixture or repo paths the command may write."
            },
            "allowed_write_directories": {
              "$ref": "#/$defs/path_list",
              "description": "Fixture or repo directories below which the command may write recursively."
            },
            "required_paths": {
              "$ref": "#/$defs/path_list",
              "description": "Paths that must exist after command execution."
            },
            "forbidden_paths": {
              "$ref": "#/$defs/path_list",
              "description": "Paths that must not be created or modified."
            }
          },
          "additionalProperties": false,
          "description": "Filesystem expectations after the adapter command runs."
        },
        "idempotency": {
          "type": "object",
          "required": [
            "run_twice"
          ],
          "properties": {
            "run_twice": {
              "type": "boolean",
              "description": "Whether to run the command twice against the fixture."
            },
            "ignored_stdout_json_paths": {
              "type": "array",
              "items": {
                "type": "array",
                "minItems": 1,
                "items": {
                  "type": "string",
                  "minLength": 1
                }
              },
              "description": "Explicit volatile JSON paths omitted only from repeated-run stdout comparison."
            }
          },
          "additionalProperties": false,
          "description": "Repeated-run behavior expected from the adapter."
        },
        "safety": {
          "type": "object",
          "required": [
            "no_writes_outside_repo_root"
          ],
          "properties": {
            "no_writes_outside_repo_root": {
              "type": "boolean",
              "description": "Whether writes outside the repository root are forbidden."
            }
          },
          "additionalProperties": false,
          "description": "Safety invariants checked during conformance."
        }
      },
      "additionalProperties": false,
      "description": "Expected process, stream, filesystem, idempotency, and safety results."
    },
    "migration_status": {
      "const": "source-maintenance-only",
      "description": "Historical generated-operation fixture; never current native/public command conformance. The public command inventory belongs to source_decision_contract.json native_cli."
    }
  },
  "additionalProperties": false,
  "$defs": {
    "field_assertion": {
      "type": "object",
      "required": [
        "path",
        "equals"
      ],
      "properties": {
        "path": {
          "type": "array",
          "minItems": 1,
          "items": {
            "type": "string",
            "minLength": 1,
            "description": "One path segment in the parsed output field selector."
          },
          "description": "Path to the parsed output field under test."
        },
        "equals": {}
      },
      "additionalProperties": false,
      "description": "Reusable assertion against a parsed output field."
    },
    "path_list": {
      "type": "array",
      "items": {
        "type": "string",
        "description": "One path in a filesystem expectation list."
      },
      "description": "Reusable list of fixture or repository paths."
    }
  },
  "x-agentic-workspace-doc-role": "contract-reference"
}
