{
  "migration_status": "source-maintenance-only",
  "schema_version": "agentic-workspace/conformance/v1",
  "id": "verification.report.process",
  "operation_id": "verification.report.report",
  "adapter": {
    "kind": "process",
    "command_template": [
      "{agentic_verification_cli}",
      "report",
      "--target",
      ".",
      "--format",
      "json"
    ],
    "cwd": "fixture_root"
  },
  "fixtures": [
    {
      "id": "verification-report-process",
      "files": {
        ".git/.keep": "",
        "README.md": "# Fixture\n"
      }
    }
  ],
  "expectations": {
    "exit": {
      "code": 0
    },
    "stdout": {
      "format": "json",
      "field_assertions": [
        {
          "path": [
            "status"
          ],
          "equals": "absent"
        },
        {
          "path": [
            "configured"
          ],
          "equals": false
        }
      ]
    },
    "stderr": {
      "allow_non_empty": false
    },
    "filesystem": {
      "allowed_write_paths": [],
      "required_paths": [
        ".git/.keep",
        "README.md"
      ],
      "forbidden_paths": [
        ".agentic-workspace"
      ]
    },
    "idempotency": {
      "run_twice": true
    },
    "safety": {
      "no_writes_outside_repo_root": true
    }
  }
}
