{
  "migration_status": "source-maintenance-only",
  "schema_version": "agentic-workspace/conformance/v1",
  "id": "planning.init.lifecycle.dry-run.process",
  "operation_id": "planning.init.lifecycle",
  "adapter": {
    "kind": "process",
    "command_template": [
      "{agentic_planning_cli}",
      "init",
      "--target",
      ".",
      "--dry-run",
      "--format",
      "json"
    ],
    "cwd": "fixture_root"
  },
  "fixtures": [
    {
      "id": "init-dry-run",
      "files": {
        ".git/.keep": ""
      }
    }
  ],
  "expectations": {
    "exit": {
      "code": 0
    },
    "stdout": {
      "format": "json",
      "field_assertions": [
        {
          "path": [
            "dry_run"
          ],
          "equals": true
        }
      ]
    },
    "stderr": {
      "allow_non_empty": false
    },
    "filesystem": {
      "allowed_write_paths": [],
      "required_paths": [
        ".git/.keep"
      ],
      "forbidden_paths": [
        ".agentic-workspace",
        "AGENTS.md"
      ]
    },
    "idempotency": {
      "run_twice": true
    },
    "safety": {
      "no_writes_outside_repo_root": true
    }
  }
}
