{
  "migration_status": "source-maintenance-only",
  "schema_version": "agentic-workspace/conformance/v1",
  "id": "planning.integration-apply.lifecycle.process",
  "operation_id": "planning.integration-apply.lifecycle",
  "adapter": {
    "kind": "process",
    "command_template": [
      "{agentic_planning_cli}",
      "integration-apply",
      "--proposal",
      "tmp-integration",
      "--target",
      ".",
      "--dry-run",
      "--format",
      "json"
    ],
    "cwd": "fixture_root"
  },
  "fixtures": [
    {
      "id": "integration-apply-dry-run",
      "files": {
        ".git/.keep": "",
        ".agentic-workspace/planning/execplans/tmp-owner.plan.json": "{\"kind\":\"planning-execplan/v1\",\"id\":\"tmp-owner\",\"title\":\"Temporary Owner\",\"owner_level\":\"slice\",\"lifecycle\":\"live\",\"phase\":\"implementation\",\"revision\":1,\"intent\":{},\"parent\":{},\"scope\":{},\"relationships\":{},\"next_action\":\"finish integration proof\",\"proof\":{},\"continuation\":{}}",
        ".agentic-workspace/planning/integration-proposals/tmp-integration.integration-proposal.json": "{\n  \"kind\": \"planning-integration-proposal/v1\",\n  \"id\": \"tmp-integration\",\n  \"status\": \"pending\",\n  \"phase\": \"integration-pending\",\n  \"requested_transition\": \"mark-integrated\",\n  \"owner\": {\"id\": \"tmp-owner\", \"ref\": \".agentic-workspace/planning/execplans/tmp-owner.plan.json\"},\n  \"external_ref\": \"\",\n  \"proof_refs\": [\"fixture-proof\"],\n  \"parent_boundary\": \"parent remains open in fixture\",\n  \"preserved_invariants\": [\"dry-run does not mutate fixture state\"],\n  \"expected_subject_revision\": \"d3084f69ef57bc27\",\n  \"expected_planning_revision\": \"bfb4473b4a515959\",\n  \"created_at\": \"2026-01-01T00:00:00Z\",\n  \"updated_at\": \"2026-01-01T00:00:00Z\",\n  \"proposal_revision\": \"fixture-revision\",\n  \"authority_boundary\": {\"proposal\": \"fixture\", \"integrated_truth\": \"receipt after apply\", \"non_authority\": [\"state\"]}\n}\n"
      }
    }
  ],
  "expectations": {
    "exit": {"code": 0},
    "stdout": {
      "format": "json",
      "field_assertions": [
        {"path": ["dry_run"], "equals": true},
        {"path": ["operation_receipt", "outcome"], "equals": "integrated"}
      ]
    },
    "stderr": {"allow_non_empty": false},
    "filesystem": {
      "allowed_write_paths": [],
      "required_paths": [
        ".git/.keep",
        ".agentic-workspace/planning/execplans/tmp-owner.plan.json",
        ".agentic-workspace/planning/integration-proposals/tmp-integration.integration-proposal.json"
      ],
      "forbidden_paths": [".agentic-workspace/planning/integration-receipts/tmp-integration.integration-receipt.json"]
    },
    "idempotency": {"run_twice": false},
    "safety": {"no_writes_outside_repo_root": true}
  }
}
